text,sentiment
"Global sports equipment maker Amer Sports Corp. , whose brands include Atomic , Salomon and Wilson , saw a 64 percent increase in third-quarter net profit to EURO 47.4 million $ 65 million on strong sales and cost cuts .",1
The reduction notice applied to 17 people .,-1
Net sales in 2006 totaled EUR 302 million and the operating margin was 16 % .,0
"Juhani J+Ærvi , Corporate Executive Vice President of Kesko , says the Russian food retail sector is fragmented .",0
"M-real generated a turnover of EUR5 .6 bn in 2006 and has 15,500 employees .",0
"Profit after taxes for the period was up to EUR0 .9 m , from EUR0 .01 m last year .",1
"Wartsila won the contract in October 2007 and the plant will be installed at Manturovo in the Kostroma region of Russia , about 600 km northeast of Moscow , Russia .",1
Cramo slipped to a pretax loss of EUR 6.7 million from a pretax profit of EUR 58.9 million .,-1
"With the acquisition , the company will expand its offering to North , Central and South America , it said .",1
"Rautalinko was resposnible also for Mobility Services , and his job in this division will be continued by Marek Hintze .",0
"Finnish construction group Lemminkainen Oyj HEL : LEM1S said today it has won a contract to provide technical services for the Nevsky Centre shopping mall to be opened in November in St Petersburg , Russia .",1
"Our strong company brands - ESL Shipping , Leipurin , Telko and Kaukomarkkinat - aim to be the market leaders in their sectors .",1
Fancy Dans on the move FAB Glasgow gift and interiors store Fancy Dans is moving !,0
"Since the association 's data do not cover sales figures from about 100 small local breweries and sales of imported beer products , the actual market shares of its members are smaller than those given in the report .",-1
"According to CEO Matti Karppinen , Frozen Foods posted a good result in 2010 , as it did in 2009 .",1
The company may at any time have in its possession one tenth of all its shares at the maximum .,0
CapMan made its initial investment in OneMed in June 2006 .,0
"Finnish Scanfil , a systems supplier and contract manufacturer to the communications sector and the electronics industry , reports its net sales totalled EUR 94.7 mn in the first half of 2010 , down from EUR 99.5 mn in the first half of 2009 .",-1
The first group of customers to be trained will be paint-shop owners and their assistants .,0
"The company 's transportation business is conducted through Florida Rock & Tank Lines , which is a Southeastern transportation company concentrating in the hauling by motor carrier of liquid and dry bulk commodities .",0
28 January 2011 - Finnish technology center operator Technopolis Oyj (HEL : TPS1V)said today it will invest EUR22 .5 m in the construction of the second phase of an office facility in Tampere .,0
CORPORATE IT UPDATE - ( C ) 1995-2009 M2 COMMUNICATIONS LTD Finnish technology group Teleste Corporation ( OMX Helsinki : TLT1V ) reported on Wednesday ( 4 February ) an operating profit of EUR5 .6 m on net sales of EUR108 .7 m for the year 2008 .,0
The total investment in 2006 and 2007 is expected to amount to about EUR75m .,0
The category was marked by maturity and the recession .,0
Sanoma Corporation wants a new and better frequency for the Helsinki metropolitan area .,0
"LONDON AFX - UK and European brokers ' recommendations issued today , as collated by AFX News from a range of market sources .",0
Russia wants to utilise its huge forest reserves in a very different way from what has been done so far .,0
"The contract consists of a new building with an area of 18,000 sq m and renovation of the existing buildings .",0
Fortum also has a blocking stake in Northwestern TGK-1 .,0
"UPM-Kymmene Corp. , the world 's largest maker of magazine paper , on Tuesday reported a 19-percent profit drop as lower paper prices , higher costs and a strong euro hurt revenue .",-1
"The Tekla Structures product box , if needed , is now made from recycled material .",0
"Comparable net sales are expected to increase more than 10 % in 2008 , in line with group target .",1
`` The combined activities will create value for shareholders and be good for our employees and customers .,1
The goal is significant expansion in Finland and in the northern Baltic region .,0
"DnB Nord of Norway is the `` most likely Nordic buyer '' for Citadele , while Nordea would be a `` good strategic fit '' , according to the document published by Pietiek .",0
"Outotec , headquartered in Espoo , Finland , is a leading provider of process solutions , technologies and services for the mining and metallurgical industries .",0
"The outsourcing agreement , which covers equipment and depots in Turku and Tampere , will run for five years , Cramo said on Thursday .",0
"The total headcount reduction will be 50 persons , the company said .",-1
The Finnish paints company acquired the remaining 49 pct that it did not own from Ukraine 's LGU for an undisclosed sum .,0
"Profit for the period was EUR 9.8 mn , up from EUR 6.0 mn in 2004 .",1
Ahlstrom 's share is quoted on the NASDAQ OMX Helsinki .,0
NASDAQ-listed Yahoo Inc has introduced a new service that enables Malaysians to take their favorite Internet content and services with them on their mobile phones .,1
The upgraded factory is scheduled to come on stream in the summer of 2008 .,0
"And the broker repeated its ` buy ' rating , based on expectations that current restructuring will lead to a clear improvement in performance in Europe in 2007 .",1
They will be sunk to a depth of some 360-380 metres and fixed to the bottom mud by vacuum .,0
He is resting comfortably and is looking forward to getting back to work . '',0
Finnish glass technology group Glaston Corporation ( OMX Helsinki : GLA1V ) reported on Thursday ( 14 August ) an operating profit of EUR6 .5 m on net sales of EUR201 .5 m for the period January-September 2008 .,0
The forecast for 2012 is 3.3 % .,0
Operating profit rose to EUR 9.2 mn from EUR 6.8 mn in the corresponding period in 2007 .,1
"In January-September 2007 , operating profit totaled EUR 20.5 mn .",0
Previously the company has estimated its operating profit to reach the level of 2005 only .,1
Operating profit in the fourth quarter fell to EUR33m from EUR39m a year earlier .,-1
The resignation will be in effect immediately .,0
Dragonfly Love is another video shot from start to finish using the Nokia N8 .,0
"The buyer is real estate owner Propertos Oy , but the companies have agreed not to disclose financial details of the deal .",0
"Microsoft also churned up its courtship , agreeing to use the Navteq mapping service , which is offered by a company Nokia bought for $ 8.1 billion a few years ago .",1
"`` The industry is coming to an interesting fork in the road as both handset manufacturers and wireless carriers attempt to serve as the portal for Web-based service to your wireless handset , '' he wrote .",0
"After the acquisition , Basware 's preliminary pro forma net sales for 2005 amount to EUR 52.6 mn , and preliminary pro forma operating profit amounts to EUR 7.1 mn .",0
"Meanwhile , Nokia said that it will be able to deliver a complete range of services from deployment operations to consulting and integration to managed services as a result of the buyout .",1
"The flagship will open this fall in Manhattan 's Flatiron District in the `` Toy Building , '' at 200 Fifth Avenue .",0
The first of the two project phases is expected to be completed by the end of 2012 .,0
"Sales in Finland decreased by 10.5 % in January , while sales outside Finland dropped by 17 % .",-1
"- The Group - s cumulative sales during the review period were EUR 48.2 million EUR 53.1 million , 1-9/2007 and profit before taxes was EUR 1.2 1.4 million .",0
"Cathay Forest 's strategy is to develop sustainable , regenerative forest assets .",0
"The company operates its business through two reportable segments , including Banking and Investment Services , and Non-Life Insurance .",0
Finnish construction company Lemminkainen Oyj HEL : LEM1S said yesterday that it would build a plastic film extrusion plant for packaging materials supplier Ab Rani Plast Oy at Lemminkainen 's Kaluga industrial park in Russia .,0
"The estimated turnover of the new company is LVL 2,5 million EEK 40 million .",0
European traffic grew nearly 30 % .,1
Aviation Systems Maintenance is based in Kansas and generated net sales of USD 2.6 million for 2008 .,0
The company has a wide selection of metal products and services .,0
"According to Tyrv+Æinen 's estimation , Japan is a very essential location in terms of Finnair 's Asian strategy .",0
"The earnings per share for the quarter came in at 0.25 eur , up from the 0.20 eur of the same quarter a year earlier .",1
He also mentions that this improvement to the service follows the recent expansion of the Finnlines service from Bilbao via Antwerp and Helsinki and from Hull via Helsinki to St. Petersburg .,1
"SysOpen Digia Plc , Press release , 7 February 2006 IBM Finland has rewarded its most distinguished partner companies for 2005 .",1
The Line 4 will run fully underground and will comprise 10 stations which will be executed in two implementation stages .,0
`` Our customer has been satisfied with Basware Invoice Automation solution and extends the implementation to new geographies .,1
Cymed 's net sales are expected to amount to EUR 3.5 mn in 2006 .,0
Raute Corporation has received orders worth over EUR 12 million from OOO Ilim Bratsk DOK in Russia .,1
Dutch publisher De Vijver said today it has agreed to buy a 49 % stake in Belgian weekly magazine Humo from Finnish media company Sanoma HEL : SAA1V .,0
"Operating loss before non-recurring items was EUR 0.9 mn , compared to a profit of EUR 11.5 mn in 2008 .",-1
"Operating profit for the 12-month period decreased from EUR2 .9 m while turnover increased from EUR24 .5 m , as compared to the financial year 2004 .",-1
The company 's main shareholders Lihakunta and Itikka Osuuskunta have both made a commitment to acquire shares worth EUR 20mn .,0
TeliaSonera has secured deliveries for 4G modems with support for 3G and 2G during the second quarter 2010 .,1
"The executive said that countries such as Brazil , Chile , Argentina and Mexico will lead the adoption in the business Ethernet services segment , while Brazil and Mexico will be the early adopters of carrier Ethernet for mobile backhaul .",0
Vacon recently announced plans to build its North American headquarters at 5 Business Park in Chambersburg .,0
"( ADPnews ) - Nov 9 , 2009 - Four companies have agreed to buy for a combined SEK 5.9 billion ( USD 854m-EUR 571.8 m ) all drug stores offered for sale as part of the restructuring of Swedish stated-owned pharmacy monopoly Apoteket AB , t",1
Both companies ' existing investment plans will be coordinated .,0
"Fortum expects its annual capital expenditure in the next four to five years to be within a range of EUR 0.8-1 .2 billion , as earlier announced .",0
The sale of the Healthcare Trade business supports Oriola-KD 's strategy to focus on Pharmaceutical Wholesale and Retail businesses .,1
Sponda Plc Stock Exchange Release 5 December 2006 at 15.45 EUR 1.5 BILLION SYNDICATED CREDIT FACILITY FOR SPONDA Sponda has signed an agreement for a one-year syndicated credit facility for a total of EUR 1.5 billion .,1
"Published by Globes online , Israel business news - www.globes-online.com - on November 16 , 2009 -_ Copyright of Globes Publisher Itonut 1983 Ltd. 2009",0
"By the end of 2006 , the number of joint branch offices will total 170 .",0
"The redesigned crushing circuit has been in operation since the start of September and its overall production rate on a weekly basis is in excess of an average of 40,000 tonnes a day .",0
"According to HKScan Finland , the plan is to increase J+Ærvi-Suomen Portti 's net sales to EUR 80mn to EUR 100mn .",1
"Talvivaara Mining Company PLC ( Talvivaara Mining ) ( LSE : TALV ) , a Finland-based nickel mining business , has installed its second production line at its metals recovery plant on June 9 , 2010 .",0
"Swedish , Finnish and Danish listed companies are organized in three market cap segments , Nordic Large Cap , Mid Cap and Small Cap .",0
"Making matters more difficult , the company said it has been grappling with higher oil and gas prices , which have pushed up the cost of energy , raw materials and transportation .",-1
"It currently employs about 750 people and expects headcount to reach 1,000 by end of 2007 .",1
Tielinja generated net sales of 7.5 mln euro $ 9.6 mln in 2005 .,0
New Novator products are supposed to be exported .,0
The turbines are expected to be launched by the end of 2012 .,0
"`` We have a group of 120 volunteers made up of Digicel employees who will manage the distribution ... Over the next week , they will distribute the 19,000 tents to more than 150 organizations , '' Digicel Haiti CEO Maarten Boute said .",0
Net sales are expected to remain on the same level as in 2007 .,0
It is a solid credit that has been compared to a DZ Bank or a Rabobank .,1
"Suominen Corporation estimates that the cost-cutting program that started in autumn 2005 , higher sales prices , and expected growth in volume of Wet Wipes , will make the company 's operations more profitable .",1
"Complete name of shareholder : Otto Henrik Bernhard Nyberg For further information , please contact Maija-Liisa Friman , CEO , tel. +358 9 7597 0711 .",0
"Operating profit decreased to nearly EUR 1.7 mn , however .",-1
Also construction expenses have gone up in Russia .,-1
The lay-offs will start gradually and will last from one to six weeks .,0
Castecka said the town hall would hold talks with other investors interested in the zone .,0
The company plans to increase the unit 's specialist staff to several dozen -- depending on the market situation during 2010 .,0
"Talvik says the relocation of application programs on servers will continue , while HP servers were approved because of HP supplying a tailor-made solution to Elisa .",0
The MET is located in the Central Business District ( CBD ) of Bangkok .,0
"A total of 15,000 new Citycon shares with a nominal value of EUR 1.35 per share were subscribed between 17 and 23 March 2006 exercising the A-B-C options based on the company 's stock option plan 1999 .",0
"The center offers a comprehensive range of device design services spanning from electronics , mechanics and software design to a full range of testing laboratory services .",0
"The report profiles 614 companies including many key and niche players worldwide such as Black & Decker Corporation , Fiskars Corporation , Fiskars Brands , Inc. , Husqvarna Outdoor Products Inc. , K+S Group , Ryobi Technologies , Inc. , The Scotts Miracle-Gro Company , and Van Group , Inc. .",0
"Following its strategy , Tikkurila has established a fully-owned sales company TOO Tikkurila in Almaty , Kazakhstan , for marketing decorative paints under the Finnish Tikkurila brand and the Russian Teks brand .",0
"In Q1 of 2009 , the company 's result before taxes from continuing operations , excluding non-recurring items , totalled EUR -0.4 mn , compared to EUR -0.1 mn in the corresponding period in 2008 .",-1
The repurchases shall decrease the distributable capital and reserves .,-1
Altogether 150 subjects with mildly elevated cholesterol levels participated in the four-month long intervention .,0
"In September 2010 , the Finnish group agreed to buy Danish company Rose Poultry A-S for up to EUR23 .9 m in a combination of cash and stock .",1
Any investment or investment activity to which this communication relates is only available to relevant persons and will be engaged in only with relevant persons .,0
The training modules aim at strengthening the public accounting abilities and fulfilling communal project management .,1
"In Finland , metal sector company Componenta is laying off temporarily the staff of its Pori mill from Christmas 2008 till 6 January 2009 .",-1
No financial or pricing details were disclosed .,0
Protalix has $ 42 million in cash and no sales .,0
Kesko has previously published a stock exchange release concerning the deal on 7 February 2007 .,0
"Finnish construction machinery and equipment rental group Cramo Oyj said on March 21 , 2007 its Swedish sector subsidiary Cramo AB will sell its Dutch subsidiary Cramo Nederland B.V. ( CNL ) to Dutch rental and scaffolding company Jaston Groep B.V. for an undisclosed sum .",0
The beers differ slightly from mainstream beers .,0
"Profit for the period was EUR 10.9 mn , down from EUR 14.3 mn in 2009 .",-1
The fair value of investment properties was EUR 2 251.0 ( 1 281.4 ) million .,0
"The share capital of Alma Media Corporation (business ID 1944757-4)is EUR 45,031,513.80 and it is divided into 75,052,523 shares .",0
"Operating profit totalled EUR 9.6 mn , down from EUR 42.0 mn the year before .",-1
"The total delivery volume of paper businesses in 2010 was 1,155,000 tonnes , up from 1,132,000 tonnes in 2009 .",1
"The portfolio comprises of 118,000 m2 of leasable space with a vacancy rate of roughly 5 % , let to around 140 tenants of which two of the largest are the Swedish government and Ericsson .",0
"An additional amount , capped at EUR12m , is payable in cash upon the achievement of certain financial performance targets in 2007 .",0
"We have sound experience of project deliveries for large multi-purpose complexes and sports arenas '' , says Sami Eronen , SVP , Infrastructure and Northern Europe , Ruukki Construction .",0
"Cash flow from operations totalled EUR 7.4 mn , compared to a negative EUR 68.6 mn in the second quarter of 2008 .",1
"( ADP News ) - Sep 30 , 2008 - Finnish security and privacy software solutions developer Stonesoft Oyj said today that it won a USD 1.9 million ( EUR 1.3 m ) order to deliver its StoneGate network security products to an unnamed Russian te",1
"Metrics in QPR ScoreCard now support date , text and milestone-based values , which improve its support for managing projects around performance or process-related content .",1
"Result before taxes decreased to nearly EUR 14.5 mn , compared to nearly EUR 20mn in the previous accounting period .",-1
"Sales VAT inclusive expanded by 19 percent , to 351 million euros .",1
Finnish forest machinery manufacturer Ponsse has agreed with Volvo on the start of cooperation in Latin America .,1
Bluewin Security is available as a monthly subscription .,0
"At the same time , sales development in Russia was boosted by the opening of Stockmann Nevsky Centre in St Petersburg .",1
"The divestment is in line with the company 's plans to focus on selected growth segments and streamline corporate structure , the company explained .",1
"The new agreement , which expands a long-established cooperation between the companies , involves the transfer of certain engineering and documentation functions from Larox to Etteplan .",1
The total value of the deal is USD 29mn .,0
The new location is n't the only change Wellmont has in store for its air transport service .,0
"According to the company , its operating profit , excluding non-recurring items , in the fourth quarter of 2009 was significantly better than expected , and also better than the figures for the fourth quarter of 2008 .",1
"Profit before taxes was EUR 5.4 mn , up from EUR 3.6 mn a year earlier .",1
`` Low energy consumption and flexible loading are just a few of the advantages of the CHF Pro . '',0
The winners included the Honda Odyssey for minivan and the Nissan Armada for large SUV .,0
The invention carries International Patent Publication No. .,0
Rapala VMC Corporation ( Rapala ) is a Finland-based company engaged in the manufacture and distribution of fishing equipment and accessories .,0
Cargotec Germany GmbH has been awarded a contract by Stadtverwaltung Mainz for chassis bodies under Open procedure .,1
OP-Pohjola Group 's capital adequacy ratio under the Act on Credit Institutions stood at 12.1 % and Tier 1 ratio at 12.1 % .,0
Finnish airline Finnair is starting the temporary layoffs of cabin crews in February 2010 .,-1
"However , the brokers ' ratings on the stock differ .",0
"The approximately 20,000 dwt vessel has been ordered from India .",0
Clothing chain Sepp+Æl+Æ 's net sales increased by 7.0 % to EUR 30.8 mn .,1
"Destia Oy is a Finnish infrastructure and construction service company building , maintaining and designing traffic routes , industrial and traffic environments , but also complete living environments .",0
Viking Line has canceled some services .,-1
"POYRY PLC Additional information by : Martin Kuzaj , President , Industry Business Group , Finland Tel. +358 10 33 21179 Sanna Paivaniemi , Director , Investor Relations , Poyry PLC , Finland Tel. +358 10 33 23002 Poyry is a global consulting and engineering company dedicated to balanced sustainability .",0
"The poorest index figure was given to Finnish power company Fortum , 4.5 .",-1
"The start of the negotiations , relating to Glaston 's efficiency program , was announced in October .",0
The compnay also said that it would lower the price of development projects by about one third compared with last November .,0
"`` This contract demonstrates our ability to apply our minerals and metals technologies in adjacent industries , such as oil shale processing .",1
Operating profit decreased to EUR 16mn from EUR 21.1 mn in 2008 .,-1
Net profit was 35.5 mln compared with 29.8 mln .,1
"Most of the growth in beer consumption took place in the Far East , Latin America and Africa .",0
Brazilian mobile player Telemig Celular yesterday announced that it has selected Finnish software developer Tecnomen Oyj to expand its prepaid billing system .,1
Rivals say Qualcomm has fewer patents on 3G phones than on earlier versions and should lower its rates .,-1
"`` UPM 's deliveries increased during the third quarter by 4 percent , and the efficiency of operations improved , '' Chief Executive Jussi Pesonen said .",1
All Amer Sports companies develop and manufacture technically advanced products that improve the performance of active sports participants .,0
"Thus the group 's balance sheet will have about EUR25 .8 m in goodwill for 2010 , the company added .",0
The company said that the fall in turnover had been planned .,-1
Revenues at the same time grew 14 percent to 43 million euros .,1
The divested activities had net sales of EUR 145.1 million in 2009 and an operating profit of EUR 8.9 million .,0
"Glaston 's share GLA1V is listed on the NASDAQ OMX Helsinki , Mid Cap List .",0
Two of these contracts are for turntable anode vibrocompactors that will be delivered to Gansu Hualu Aluminum Co Ltd and another unnamed costumer .,0
"`` Thanks to my Nokia and Lulu , I am now proud to be a published His novel can be found here .",0
"Finnish silicon wafer technology company Okmetic Oyj ( OMX Helsinki : OKM1V ) reported on Thursday ( 7 August ) an operating profit of EUR5 .3 m for the period January-June 2008 , up from EUR3 .3 m in the corresponding period in 2007 .",1
Technopolis is Europe 's leading operator of technoparks .,1
The order is related to renewing the network of the telecommunications operator .,0
"Finnish electronics contract manufacturer Scanfil reports net sales of EUR 58.9 mn in the second quarter of 2007 , down from EUR 62.4 mn a year earlier .",-1
"In Finland , Hamina Cargo Terminal , of Finnish Nurminen Logistics , has purchased a warehouse with ground lease rights in the Port of Hamina .",0
"Outotec is currently delivering a new oil shale processing plant for Eesti Energia in Estonia based on Enefit technology , which has been developed jointly by Eesti Energia and Outotec .",0
"Net income from life insurance doubled to EUR 6.8 mn from EUR 3.2 mn , and net income from non-life insurance rose to EUR 5.2 mn from EUR 1.5 mn in the corresponding period in 2009 .",1
"The sellers include 40 shareholders , including Intellibis management , employees and other investors .",0
"About 36 % of this came from Aspo Chemicals , 39 % from Aspo Shipping and 25 % from Aspo Systems .",0
Rubin says he expects Capman to announce 1-2 additional transactions in 2009 .,0
The second-quarter net sales are expected to be on par with the first quarter of 2009 .,0
IonPhasE 's second major owner is venture capital firm Aura Capital .,0
"The scope of the project is to find the most cost-efficient method for phosphorous removal and to deliver the storing and dosing equipment , which can be used in continuous operation at the plants .",0
"In Q1 of 2010 , Bank of +_land 's net interest income increased from EUR 9.1 mn to EUR 9.7 mn .",1
Nordea was the cheapest also for a couple in their 30s with debt .,0
A spokeswoman for the Italian fashion house declined comment on the settlement .,0
The investment will be worth approximately EUR 100mn .,0
"In 2008 , Kemira recorded revenue of approximately EUR 2.8 billion and had a staff of 9,400 .",0
The platform would continue to be the development framework for Symbian and MeeGo .,0
"Divisional sales demand in the half remained `` inconsistent '' , it added .",-1
"Efore 's presence here also opens up new and interesting development opportunities for our students , '' the dean of the Faculty of Electronics , Communications and Automation at TKK said .",1
And U.S. energy executives say high steel prices are threatening energy exploration .,-1
"According to the company 's updated strategy for the years 2009-2012 , Basware targets a long-term net sales growth in the range of 20 % -40 % with an operating profit margin of 10 % -20 % of net sales .",1
After the renovation the biggest moulding line in the Orhangazi foundry is the most modern line in Europe .,1
"It 's `` finger-friendly '' , and to my opinion , really fast .",0
"Under the plan , which CSES worked out together with Public Policy Management Institute ( PPMI ) and other partners , buildings with a total area of 10,000 square meters should be built on the territory in the first phase .",0
