text,sentiment
Competition authorities will have to approve the deal before it can be finalized .,0
"M-real Corporation Press release on 3 November at 10:35 am M-real Corporation was the second best company in the materials sector including e.g. forest industry companies in the Carbon Disclosure Leadership Index CDLI , Nordic Report 2009 .",1
Exports grew 16.5 percent to 19.1 million liters .,1
"F-Secure , a developer of security solutions as a service through Internet Service Providers and mobile operators , announced results from its annual Online Wellbeing Survey .",0
The plan is estimated to generate some EUR 5 million ( USD 6.5 m ) in cost savings on an annual basis .,1
"Nokia bought Chicago-based Navteq in 2008 , acquiring a maps database to compete with Google s maps as well as with navigation device companies such as TomTom NV and Garmin Ltd. .",1
"As a result , the company will temporarily lay-off 25 % of the whole personnel , approximately 270 persons at Kirkkonummi and Nivala factories .",-1
"The decision of the French Court relates to the claims raised by twenty-one former Aspocomp S.A.S employees , the company said .",0
This is the second successful effort for the financial investor this year .,1
"As a result of these transactions , the aggregate holdings of Burrill Life Sciences Capital Fund , L.P. has decreased below 5 per cent of the total number of shares and votes of the Company .",-1
Operating income rose to EUR 696.4 mn from EUR 600.3 mn in 2009 .,1
"Luna took fifth place on six-under 207 , a shot behind Spain 's Beatriz Recari and Germany 's Martina Eberl , while Welsh player Becky Brewerton was the highest-placed British finisher , sharing seventh place on three-under 210 after shooting 71 .",0
The layoff talks were first announced in August .,0
Our tools are specifically designed with the needs of both the business users and ICT experts in mind .,0
Finnish Componenta has published its new long-term strategy for the period 2011-2015 with the aim of growing together with its customers .,0
Rautaruukki aims to find work from the group 's other locations for those who have been made redundant .,0
Operating profit fell to EUR 6.2 mn from EUR 8.5 mn in the third quarter of 2007 .,-1
The negotiations concern 246 salaried and senior salaried employees and are scheduled to be completed in six weeks .,0
"During the strike , Finnair estimates to incur a net loss of between EUR2m and EUR2 .5 m per day .",-1
The carrier said its Area travel agency is to sell most of its outlets to sister chain Suomen Matkatoimisto (SMT)and use its remaining bricks-and-mortar presence to primarily target business customers going forward .,0
"Patrick Jeambar will also continue being responsible for Innovation and Health , safety and environment HSEA functions of Ahlstrom Corporation .",0
Nordea Group 's operating profit increased in 2010 by 18 percent year-on-year to 3.64 billion euros and total revenue by 3 percent to 9.33 billion euros .,1
Basware finances the acquisition with a bank loan .,0
"If Honkarakenne starts production there , it will need a partner for sawmill operations .",0
Operating profit was EUR 1.6 mn in 2005 compared to EUR 5.9 mn in 2004 .,-1
"Following the impact , the Altima hit a utility pole , causing a live electric line to fall onto the roadway .",0
"Other measures included increasing synergies and economies of scale within the Grimaldi Group and personnel adjustments , divestments and redelivery of excess tonnage .",0
"Alma Media 's operating profit amounted to EUR 11.9 mn , down from EUR 15.0 mn a year earlier .",-1
The purchase sum is about EUR 10mn US$ 12.97 mn .,0
"Typically , the transmission power level can be decreased when the interference noise is above a predefined value .",0
"The latest date for registration is on 4 April , 2006 .",0
The company is also featured in the Ethibel Pioneer Investment Register and included in Innovest 's Global 100 list of the world 's most sustainable corporations .,1
The members of the management team will contribute to the adjustment measures with temporary salary cut of 5 % .,1
"The result will also be burdened by increased fixed costs associated with operations in China , and restructuring costs in Japan .",-1
"After the signing , the total amount of Aspo 's revolving credit facility agreements is EUR 50 million , which replaces the formerly valid agreements of EUR 80 million .",0
"Compared with the FTSE 100 index , which rose 28.3 points or 0.5 % on the day , this was a relative price change of 2.3 % .",1
Alma Media 's net sales in 2009 totalled MEUR 307.8 with an operating margin of 13.5 per cent .,0
Active shipping is essential for Finland .,0
"To prove the efficiency of the China Mobile system , Rod Baber , an English climber , climbed to the Mount Everest summit and successfully made calls .",1
"As the world leaders in developing UV technology for municipal wastewater , drinking water , and industrial water treatment systems , Trojan Technologies was a logical partner in providing W+Ærtsil+Æ with UV technology for ballast water treatment .",0
"Ahlstrom , headquartered in Helsinki , Finland , is a global leader in the development , manufacture and marketing of high performance fibre-based materials .",0
"An  of the invention , released by the Patent Office , said : `` A non-coherent search matrix is formed of said correlation function matrix .",0
"Samsung currently occupies third place and lost ground during the quarter , dropping by 1.8 % to an 11.1 % share overall .",-1
The aim is to develop open-source application solutions .,0
"The company designs , manufactures and markets high-quality clothing , interior decoration textiles , bags and other accessories .",0
- Cash flow from operating activities before investments was EUR 0.8 -1.2 million .,0
Changes to the as-built models from the design were communicated to the subcontractors to accommodate them into the steel and GRC fabrication process .,0
"`` The new structure provides better communication , faster decision-making and cost savings , '' Proha said .",1
"EUR928 ,000 in Q1 2010 6 May 2010 - Finnish textile and clothing design company Marimekko Oyj ( HEL : MMO1V ) said today its net profit rose to EUR928 ,000 in the first quarter of 2010 from EUR13 ,000 in the corresponding period a year earlier .",1
"The Lemminkainen Group , headquartered in Helsinki , Finland operates in all sectors of the construction industry : civil engineering , building contracting , technical building services and the building materials industry .",0
"Maximum amount of terminations in Finland is 40 employees , the company added .",0
The orders also include a few high-power drives for the control of seismic compressors .,0
A merger between UPM and Finnish-Swedish Stora Enso is not likely either .,0
"The fair value change of investment properties was EUR 15.8 mn , compared to EUR 22.9 mn in the third quarter of 2009 .",-1
"Tallink Silja attributes the significant drop to problems with the booking system that was taken into operation in October , the sale of trailer ferry ` Sky Wind ' and the route between Stockholm and Riga , which has won passengers from the Helsinki-Stockholm route .",-1
"( ADP News ) - Jan 22 , 2009 - Finnish mobile phones maker Nokia Oyj ( OMX : NOK1V ) said today its operating profit decreased to EUR 5 billion ( USD 6.5 bn ) for 2008 from EUR 8 billion for 2007 .",-1
"The product range includes marinated olives , cold cuts , and pates , for example .",0
"Copper , lead and nickel also dropped ... HBOS ( HBOS ) plummeted 20 % to 70.3 pence after saying this year+ ??",-1
"Moreover , Konecranes and Kito intend to transfer the hoist distribution business of Konecranes ' Japanese joint venture MHS Konecranes to Kito .",0
In 2005 the bank posted a net profit of Lt 8.2 mn .,0
Finnish aluminium products manufacturer Nordic Aluminium Plc ( OMX Helsinki : NOA1V ) reported on Monday ( 18 August ) an operating profit of EUR7 .9 m on net sales of EUR55 .2 m for the period January-June 2008 .,0
"According to Arokarhu , some of the purchases that had been scanned into the cash register computer disappeared when the total sum key was pressed .",-1
"The most important export markets are Norway , Germany , Russia and France .",0
Finnish cutlery and hand tools maker Fiskars Oyj Abp ( HEL : FISAS ) said today its net profit rose to EUR 24.1 million ( USD 33.6 m ) in the third quarter of 2010 from EUR 17.9 million a year earlier .,1
Operating profit rose from EUR 1.94 mn to EUR 2.45 mn .,1
"Finnish Bank of +_land reports operating profit of EUR 2.2 mn in the first quarter of 2010 , down from EUR 6.3 mn in the corresponding period in 2009 .",-1
"ABOUT MIDNIGHTTRADER : MidnightTrader is the premier source of extended-hours US equity trading analysis , news and forecasting for the retail and institutional investment community .",0
"YIT acquired investment rights to a 10,000 square metre residential project in Yaroslavl and to a 16,400 square metre project in Moscow .",0
"As a result , it has started negotiations with the banks on provisional amendments concerning the covenants and other credit terms .",0
"Paychex has more than 100 offices serving approximately 554,000 payroll clients nationwide as of May 31 , 2009 .",0
"Kone 's factory located at Ayanambakkam , a suburb to the west of Chennai , is a fully integrated facility which gives it the capability to address costs .",1
"GeoSentric is acquiring extra financing by issuing a maximum of 220,000 new shares and a convertible bond with subscription rights for 880,000 shares , which have been fully subscribed .",0
"The company said Offshore segment represented 43 % of the total marine engines orders for the July-September 2010 period , Merchant 33 % , Special vessels 18 % , and Cruise and Ferry , and Ship Design -- 2 % and 3 % , respectively .",0
The group had an order book of EUR 7.74 mn at the end of 2007 .,0
"With CapMan as a partner , we will be able to further develop our business and continue to focus on providing quality restaurant services for our customers , '' says Christopher Wynne , CEO of Papa John 's Russia .",1
The agreement must be approved by the Russian competition authorities before it enters into force .,0
"Pre-tax profit totaled EUR 397.4 mn , up from EUR 164.7 mn .",1
"Outotec 's scope of delivery covers the engineering , supply of special equipment and services for a calcination plant with two circulating fluid bed calciners .",0
"The contract covers installation , training and start-up services .",0
"In the Baltic countries , development of operations and reorganisation continued , and non-recurring items related to the takeover process lowered earnings .",-1
"For Teleste , the acquisition marks an entry into services business in a market where it has long been an established and significant supplier of products .",1
The company will make its marketing and sales investments initiated in 2009 even more efficient in 2010 .,1
The company closed last year with a turnover of about four million euros .,0
"Technopolis and the St. Petersburg government signed a cooperation memorandum in October 2005 to set up a techno-park in the Neudorf production zone in the village of Strelny , in the St. Petersburg suburbs .",1
"In January-September 2010 , Fiskars ' net profit went up by 14 % year-on-year to EUR 65.4 million and net sales to EUR 525.3 million from EUR 487.7 million .",1
"So far Norwegian Norske Skog has reduced the staff levels by 1,000 people and plans to reduce production by 200,000 tons in 2008 , while Finnish-Swedish Stora Enso is to cut staff by 1,700 people and production by 500,000 tons .",-1
Actions to improve operational efficiency and adjust operations are expected to deliver annualised permanent cost savings of around EUR 4.5 million and will be effected mostly during the first half of 2010 .,1
"In China , Finnish Kone that provides elevators , escalators , and solutions for modernisation and maintenance will build 342 escalators that will be installed in a high-speed railway section between Beijing and Shanghai in a 1.5 years ' time .",1
"At 10.33 am , Huhtamaki was the market 's biggest faller , 8.69 pct lower at 11.35 eur , while the OMX Helsinki 25 was 0.32 pct higher at 3,332.41 , and the OMX Helsinki was up 0.47 pct at 11,687.32 .",-1
Earnings per share EPS rose to EUR 0.11 from EUR 0.03 .,1
Pretax profit decreased to EUR 33.8 mn from EUR 40.8 mn in the fourth quarter of 2005 .,-1
"Finnish silicon wafers manufacturer Okmetic Oyj said on June 29 , 2007 it signed an agreement with Nordea Bank Finland Plc , the local subsidiary of Swedish commercial bank Nordea Bank AB , which will refinance Okmetic 's syndicated bank facility which amounts to some 20 mln euro ( $ 26.9 mln ) .",1
"The company has the poser , who wants to impress people with the latest handset .",0
"For the first nine months of 2010 , the company 's net profit rose to EUR41m from EUR30m for the corresponding period of 2009 .",1
Shareholders of Rakvere Lihakombinaat decided in favor of the buyout of minority shares in mid-July .,1
The company plans to expand into the international market through its subsidiaries and distributors from 2011 onwards .,1
The duration of the contract is 37 months .,0
"Nokia controls more than 50 percent of phone sales in India and Africa , and has a strong prosition on most other emerging markets .",1
"For the purposes of the possible acquisition , PKC would establish a subsidiary in Poland .",0
`` Our design team has long admired Marimekko 's vivid patterns and colors .,1
"On Dec. 1 , Grimaldi acquired 1.5 million shares and a 50.1-percent stake in Finnlines .",0
"Finland-based companies , L+Ænnen Tehtaat and Raisio , have decided to dissolve the joint venture company ZAO Scandic Feed , which was established to start local animal feed business and feed production in northwest Russia .",0
"However , sales volumes in the food industry are expected to remain at relatively good levels in Finland and in Scandinavia , Atria said .",1
The EA Reng group posted sales of approximately 84 million kroons for 2007 .,0
"According to Olvi 's Managing Director Lasse Aho , the company has an ongoing MMX Plus project that aims to find growth outside Finland .",1
"Myllykoski , with one paper plant in Finland , one in the US and three in Germany , had revenues of EUR286m in the first half of 2010 and an operating loss of EUR12m , Reuters said .",-1
The fixed acquisition price amounts to NOK 70 ( approximately EUR 8.7 ) million and additional price NOK 15 ( EUR 1.8 ) million at maximum .,0
"Kemira will supply the additional volumes of iron coagulants from the company 's plant at Helsingborg , Sweden .",0
-- Christine Idzelis EQT Partners sheds Salcomp Swedish financial investor EQT Partners is selling a majority of its stake in mobile phone charger manufacturer Salcomp Oyj to Nordic investment company Nordstjernan AB .,0
"Currently , the company foresees its pre-tax profit to remain below the 2009 level when it reached EUR 700,000 USD 934,000 , compared with previous projections of a slightly better pre-tax profit .",-1
"According to the Finnish-Russian Chamber of Commerce , all the major construction companies of Finland are operating in Russia .",0
"Arvo Vuorenmaa , the Loviisa plant 's general manager said the application for the new licence was a `` standard '' procedure and that he was `` quite confident '' about approval being granted .",1
"For 2009 , Incap expects revenue of some EUR 70 million .",0
"The company is also seeking possibilities to relocate the Luumaki personnel , some 50 people , to other UPM mills .",0
"Finnish telecoms software developer Tecnomen Oyj said on December 5 , 2006 it won a $ 3.3 mln ( 2.5 mln euro ) order to supply an expansion of the charging and messaging systems for the mobile and fixed networks of Brasil Telecom .",1
"Aldata Solution Oyj Bertrand Sciard President and CEO Further information : Aldata Solution Oyj , Bertrand Sciard , President and CEO , tel. +33 1 46 48 28 00 Aldata 100 % Retail-Wholesale At Aldata 100 % of our business is dedicated to retail and wholesale business improvement .",0
"Budapest , August 10 MTI - Finnish electronics maker Elcoteq will lay off 700 workers at its plants in Pecs S Hungary at the end of September because of falling orders , communications director for Elcoteq 's local unit , Zoltan Krippl told MTI on Monday .",-1
Registration is required .,0
"CDP was established on the initiative of institutional investors ; however , the annually published results also interest an increasing number of customers and other interest groups of the reporting companies .",0
Validating our fgVoIP client through Symbian Signed represents a significant step forward in accomplishing this goal .,1
"`` That 's a very high figure on the European scale , '' Noop said , recalling however that this also includes beer bought by Finnish tourists .",0
"As of July 2 , 2007 , the market cap segments will be updated according to the average price in May 2007 .",0
It is the first application in the market for invoice and purchase requisition approval with a mobile device .,0
"The decision will have to be made whether the group agrees to the import of Estonian meat and meat products to Finland , the paper added .",0
The closing of such transaction took place today .,0
"The Ministry of Water in Tanzania has awarded Poyry a water and sanitation engineering assignment for the rehabilitation and extension of water supply and sanitation infrastructure in Bukoba and Musoma , situated at Lake Victoria in northern Tanzania .",1
The customers will have an access to integrated propeller and gear packages from one source .,0
Currently Alfred A Palmberg is putting the finishing touches to one of Finland 's biggest ever re-plumbing and bathroom refurbishment projects also in the district of Vuosaari .,0
"Production capacity will rise gradually from 170,000 tonnes to 215,000 tonnes .",1
"In addition , a good biological durability is achieved . ''",0
The court found TelecomInvest 's arguments convincing .,1
"Thanksto improvements in demand and the adjustments we have made , theutilization rates of Cramo 's fleet have substantiallyimproved . ''",1
"The pilot project proved that RIFD technology is ideal for our purposes '' , comments Olli Saarinen , Material Handling Supervisor at Yara .",1
Finnish-Swedish TietoEnator is expanding its business quickly in Russia .,1
"Advertising and circulation revenues grew by 3.4 % and by 0.4 % , respectively .",1
"Following the divestment , Fiskars 's Outdoor unit will comprise the brands Gerber , Silva and Buster , and will focus on multi-tools , knives , compasses , mobile lighting , pedometers , and aluminium boats .",0
"We are honored to be acknowledged for our commitment to the industry , especially in Asia Pacific . ''",1
"An estimated 30 pct of mobile calls are made from the home , and France Telecom hopes that 15 pct of its Orange clients will sign up for the service by the end of 2008 .",0
"The study is expected to provide proof of pharmacodynamic activity in humans , corroborate the safety profile and establish dose ranges for further therapeutic studies .",0
"A Flurry Analytics spokesperson said that , as it was only measuring Windows Phone 7 data for some weeks , the firm double-checked the data to make sure the 66 per cent rise was not an aberration .",0
"Operating result showed a loss of EUR 2.9 mn , while a year before , it showed a profit of EUR 0.6 mn .",-1
One of the challenges in the oil production in the North Sea is scale formation that can plug pipelines and halt production .,-1
Following the increase the company+EUR TM s capital totals 5.5 mln Romanian lei $ 1.98 mln-1 .56 mln euro .,0
The sales of the Tiimari segment fell by 4.0 % year-on-year to EUR3 .3 m in June 2010 .,-1
"Typical end-uses include roof structures , floorings , walls and ceilings , non-visible structures in vehicles , packaging and boxes , construction site structures , fencing and shelters , and formwork with a limited number of concrete pourings .",0
"The Committee proposes the following remuneration : a monthly remuneration of EUR 5,000 for the Chairman , EUR 3,500 for the Deputy Chairman , and EUR 2,500 for the other Board members .",0
Kone shares dropped 4.1 percent to  x20ac 43 US$ 55.77 in Helsinki .,-1
"Aldata Solution Oyj Thomas Hoyer CFO More information : Aldata Solution Oyj , Thomas Hoyer , CFO , tel. +358 45 670 0491 Aldata in brief Aldata Solution is one of the global leaders in supply chain software for retail , wholesale and logistics companies .",0
"ADP News - Nov 6 , 2008 - Finnish retail software developer Aldata Solution Oyj OMX : ALD1V said today that it swung to a net profit of EUR 2.1 million USD 2.7 m for the first nine months of 2008 versus a net loss of EU",1
"In 2007 Talentum will disclose three Interim Reports - Q1 ( January - March ) on Friday , 27 April , 2007 - Q2 ( April - June ) on Friday , 20 July , 2007 - Q3 ( July - September ) on Friday , 26 October , 2007 .",0
The board of directors also proposed that a dividend of EUR0 .20 per outstanding share be paid .,0
"The pine oil project is related to the upgrade of the chemical recovery plant of UPM at its pulp mill in Kymi , southern Finland .",0
"The floor area of the Yliopistonrinne project will be 7,900 sq m 85,030 sq ft and the building 's gross area will total 12,800 sq m. A total 25.1 % of the facilities have been let .",0
The Efore plant at Saarijarvi in central Finland is one of the largest employers in the region .,0
"As part of the reorganisation , Pohjola Insurance 's 250 field staff for private customers will join the payroll of local cooperative banks from the beginning of October 2008 .",0
Rihko said the sale will enable the company to concentrate on its grain-based business .,0
The union filed a grievance over the company 's overtime assignment policies .,-1
Financing of the project will come mainly from China .,0
Metsaliitto said that it will book a minor gain of less than EUR1 .0 m from the transaction .,1
The company operates power plants in the Tyumen and Chelyabinsk regions and in the Khanty-Mansi Autonomous District .,0
Sales have risen in other export markets .,1
"The cost of the deal could range from 70 million to 90 million euros depending on the financial results of the two companies in 2008 , the statement says .",0
"`` We have tailored our solutions to meet Solel 's technical requirements , and the result is both cost-effective manufacturing and highest-quality reflectors . ''",1
"Thanks to his wide contact network and good knowledge of market and business environment , he will give a great contribution to the further development of our Indian operations '' , tells Incap 's President & CEO Juhani Hanninen .",1
"New Delhi , July 17 -- Sahlberg Teppo , Kallio Timo and Mustonen Tuomas of M Real OYJ , Espoo , Finland have developed novel markings and methods of producing the same .",0
"The chilled meat products category led the meat , fish and poultry market in Finland , accounting for a share of 31.4 % .",0
The statutory negotiations at headquarters are part of this decrease .,0
"Oriola-KD , headquartered in Espoo , Finland , is a leading distributor of pharmaceutical and healthcare products with 1,300 employees in the Nordic and Baltic countries .",0
"To achieve synergy targets related to the acquisition , Vaisala is consolidating its manufacturing , depot and data services , and finance activities currently located in Uniontown , Pennsylvania , St. Louis , Missouri and Durham , North Carolina .",0
"The firm 's services include copying , printing , CAD-modelling , digital printing , scanning , SokoPro project bank and courier services .",0
"Intellisync Wireless Email from Nokia is a full-featured wireless e-mail solution that connects users to their e-mail , calendar , contacts , notes and task lists while away from the office , according to the company .",0
Forest certification is a voluntary system aimed at promoting sustainable forest management in commercial forests .,0
"In connection with the deal , Digia will employ 19 persons from Nokia in Oslo and in Silicon Valley in the USA .",0
"In Q1 of 2009 , Bank of +_land 's net interest income weakened by 10 % to EUR 9.1 mn .",-1
It will use the proceeds from the transaction to achieve its target .,0
"Selects Third Party Logistics Leader Transplace for Best-in-Class Technology , Procurement Capabilities ; Leading Specialty Packaging Manufacturer Employs Complete 3PL Solution for Supply Chain Visibility and Transportation Efficiency to Increase Service Levels and On-Time Deliveries",1
"Upon completion of these transactions , Metso 's stake will amount to more than 60 % .",0
"Purchase it for the 12MP snapper , if nothing else .",0
"The Apple Inc. iPhone wo n't change the game plan for Verizon Communications Inc. , Chief Executive Ivan Seidenberg said Wednesday .",0
"HUHTAMAKI OYJ STOCK EXCHANGE RELEASE 16.12.2008 AT 09:30 Huhtamaki Oyj has resolved to clarify the Group structure by separating the Foodservice and Consumer Goods businesses in its production unit in Hameenlinna , Finland by transferring the businesses into its wholly owned subsidiaries .",0
"The rewards to be paid on the basis of the earning period 2011 will correspond to the value of a maximum total of 364,000 Componenta Corporation shares including also the proportion to be paid in cash .",0
Last year SysOpen Digia invested in IBM product know-how in the building of portal and trading place systems and successfully implemented customer solutions supported by it .,1
The ore body is sufficient to support anticipated production for at least 46 years .,0
The companies ' aim is to finalize the negotiations and sign the contracts at the start of October 2008 .,0
Net investment income,0
